{
  "formatVersion": 1,
  "slug": "mib-tycon-generic",
  "name": "Tycon Generic (MIB)",
  "role": "dictionary",
  "deviceCategory": "generic",
  "vendor": "Tycon",
  "vendorOidPrefix": "1.3.6.1.4.1.45621",
  "description": "Auto-compiled with libsmi from 1 MIB module(s). 27 readable OIDs under 1.3.6.1.4.1.45621.",
  "generated": {
    "source": "mibs/tycon",
    "date": "2026-09-12",
    "oidCount": 27,
    "compiler": "smidump 0.4.8",
    "modules": [
      "TPDIN2-MIB"
    ]
  },
  "oids": [
    {
      "oid": "1.3.6.1.4.1.45621.2.1.1.0",
      "name": "name",
      "description": "Product name.",
      "type": "string",
      "walk": false,
      "metricKey": "name",
      "transform": null,
      "enumMap": null,
      "module": "TPDIN2-MIB",
      "tc": "DisplayString"
    },
    {
      "oid": "1.3.6.1.4.1.45621.2.1.2.0",
      "name": "version",
      "description": "Product version.",
      "type": "string",
      "walk": false,
      "metricKey": "version",
      "transform": null,
      "enumMap": null,
      "module": "TPDIN2-MIB",
      "tc": "DisplayString"
    },
    {
      "oid": "1.3.6.1.4.1.45621.2.1.3.0",
      "name": "builddate",
      "description": "Build date.",
      "type": "string",
      "walk": false,
      "metricKey": "builddate",
      "transform": null,
      "enumMap": null,
      "module": "TPDIN2-MIB",
      "tc": "DisplayString"
    },
    {
      "oid": "1.3.6.1.4.1.45621.2.2.1.0",
      "name": "relay1",
      "description": "Relay 1",
      "type": "integer",
      "walk": false,
      "metricKey": "relay1",
      "transform": null,
      "enumMap": null,
      "module": "TPDIN2-MIB"
    },
    {
      "oid": "1.3.6.1.4.1.45621.2.2.2.0",
      "name": "relay2",
      "description": "Relay 2",
      "type": "integer",
      "walk": false,
      "metricKey": "relay2",
      "transform": null,
      "enumMap": null,
      "module": "TPDIN2-MIB"
    },
    {
      "oid": "1.3.6.1.4.1.45621.2.2.3.0",
      "name": "relay3",
      "description": "Relay 3",
      "type": "integer",
      "walk": false,
      "metricKey": "relay3",
      "transform": null,
      "enumMap": null,
      "module": "TPDIN2-MIB"
    },
    {
      "oid": "1.3.6.1.4.1.45621.2.2.4.0",
      "name": "relay4",
      "description": "Relay 4",
      "type": "integer",
      "walk": false,
      "metricKey": "relay4",
      "transform": null,
      "enumMap": null,
      "module": "TPDIN2-MIB"
    },
    {
      "oid": "1.3.6.1.4.1.45621.2.2.5.0",
      "name": "voltage1",
      "description": "Voltage 1",
      "type": "integer",
      "walk": false,
      "metricKey": "voltage1",
      "transform": null,
      "enumMap": null,
      "module": "TPDIN2-MIB",
      "tc": "Tenths"
    },
    {
      "oid": "1.3.6.1.4.1.45621.2.2.6.0",
      "name": "voltage2",
      "description": "Voltage 2",
      "type": "integer",
      "walk": false,
      "metricKey": "voltage2",
      "transform": null,
      "enumMap": null,
      "module": "TPDIN2-MIB",
      "tc": "Tenths"
    },
    {
      "oid": "1.3.6.1.4.1.45621.2.2.7.0",
      "name": "voltage3",
      "description": "Voltage 3",
      "type": "integer",
      "walk": false,
      "metricKey": "voltage3",
      "transform": null,
      "enumMap": null,
      "module": "TPDIN2-MIB",
      "tc": "Tenths"
    },
    {
      "oid": "1.3.6.1.4.1.45621.2.2.8.0",
      "name": "voltage4",
      "description": "Voltage 4",
      "type": "integer",
      "walk": false,
      "metricKey": "voltage4",
      "transform": null,
      "enumMap": null,
      "module": "TPDIN2-MIB",
      "tc": "Tenths"
    },
    {
      "oid": "1.3.6.1.4.1.45621.2.2.9.0",
      "name": "current1",
      "description": "Current 1",
      "type": "integer",
      "walk": false,
      "metricKey": "current1",
      "transform": null,
      "enumMap": null,
      "module": "TPDIN2-MIB",
      "tc": "Tenths"
    },
    {
      "oid": "1.3.6.1.4.1.45621.2.2.10.0",
      "name": "current2",
      "description": "Current 2",
      "type": "integer",
      "walk": false,
      "metricKey": "current2",
      "transform": null,
      "enumMap": null,
      "module": "TPDIN2-MIB",
      "tc": "Tenths"
    },
    {
      "oid": "1.3.6.1.4.1.45621.2.2.11.0",
      "name": "current3",
      "description": "Current 3",
      "type": "integer",
      "walk": false,
      "metricKey": "current3",
      "transform": null,
      "enumMap": null,
      "module": "TPDIN2-MIB",
      "tc": "Tenths"
    },
    {
      "oid": "1.3.6.1.4.1.45621.2.2.12.0",
      "name": "current4",
      "description": "Current 4",
      "type": "integer",
      "walk": false,
      "metricKey": "current4",
      "transform": null,
      "enumMap": null,
      "module": "TPDIN2-MIB",
      "tc": "Tenths"
    },
    {
      "oid": "1.3.6.1.4.1.45621.2.2.13.0",
      "name": "temperature1",
      "description": "External Temp",
      "type": "integer",
      "walk": false,
      "metricKey": "temperature1",
      "transform": null,
      "enumMap": null,
      "module": "TPDIN2-MIB",
      "tc": "Tenths"
    },
    {
      "oid": "1.3.6.1.4.1.45621.2.2.14.0",
      "name": "temperature2",
      "description": "Internal Temp",
      "type": "integer",
      "walk": false,
      "metricKey": "temperature2",
      "transform": null,
      "enumMap": null,
      "module": "TPDIN2-MIB",
      "tc": "Tenths"
    },
    {
      "oid": "1.3.6.1.4.1.45621.2.2.15.0",
      "name": "voltage1String",
      "description": "Voltage 1",
      "type": "string",
      "walk": false,
      "metricKey": "voltage1String",
      "transform": null,
      "enumMap": null,
      "module": "TPDIN2-MIB",
      "tc": "DisplayString"
    },
    {
      "oid": "1.3.6.1.4.1.45621.2.2.16.0",
      "name": "voltage2String",
      "description": "Voltage 2",
      "type": "string",
      "walk": false,
      "metricKey": "voltage2String",
      "transform": null,
      "enumMap": null,
      "module": "TPDIN2-MIB",
      "tc": "DisplayString"
    },
    {
      "oid": "1.3.6.1.4.1.45621.2.2.17.0",
      "name": "voltage3String",
      "description": "Voltage 3",
      "type": "string",
      "walk": false,
      "metricKey": "voltage3String",
      "transform": null,
      "enumMap": null,
      "module": "TPDIN2-MIB",
      "tc": "DisplayString"
    },
    {
      "oid": "1.3.6.1.4.1.45621.2.2.18.0",
      "name": "voltage4String",
      "description": "Voltage 4",
      "type": "string",
      "walk": false,
      "metricKey": "voltage4String",
      "transform": null,
      "enumMap": null,
      "module": "TPDIN2-MIB",
      "tc": "DisplayString"
    },
    {
      "oid": "1.3.6.1.4.1.45621.2.2.19.0",
      "name": "current1String",
      "description": "Current 1",
      "type": "string",
      "walk": false,
      "metricKey": "current1String",
      "transform": null,
      "enumMap": null,
      "module": "TPDIN2-MIB",
      "tc": "DisplayString"
    },
    {
      "oid": "1.3.6.1.4.1.45621.2.2.20.0",
      "name": "current2String",
      "description": "Current 2",
      "type": "string",
      "walk": false,
      "metricKey": "current2String",
      "transform": null,
      "enumMap": null,
      "module": "TPDIN2-MIB",
      "tc": "DisplayString"
    },
    {
      "oid": "1.3.6.1.4.1.45621.2.2.21.0",
      "name": "current3String",
      "description": "Current 3",
      "type": "string",
      "walk": false,
      "metricKey": "current3String",
      "transform": null,
      "enumMap": null,
      "module": "TPDIN2-MIB",
      "tc": "DisplayString"
    },
    {
      "oid": "1.3.6.1.4.1.45621.2.2.22.0",
      "name": "current4String",
      "description": "Current 4",
      "type": "string",
      "walk": false,
      "metricKey": "current4String",
      "transform": null,
      "enumMap": null,
      "module": "TPDIN2-MIB",
      "tc": "DisplayString"
    },
    {
      "oid": "1.3.6.1.4.1.45621.2.2.23.0",
      "name": "temp1String",
      "description": "External Temp",
      "type": "string",
      "walk": false,
      "metricKey": "temp1String",
      "transform": null,
      "enumMap": null,
      "module": "TPDIN2-MIB",
      "tc": "DisplayString"
    },
    {
      "oid": "1.3.6.1.4.1.45621.2.2.24.0",
      "name": "temp2String",
      "description": "Internal Temp",
      "type": "string",
      "walk": false,
      "metricKey": "temp2String",
      "transform": null,
      "enumMap": null,
      "module": "TPDIN2-MIB",
      "tc": "DisplayString"
    }
  ]
}
