{
  "formatVersion": 1,
  "slug": "mib-sixnet-switch",
  "name": "Sixnet Switch (MIB)",
  "role": "dictionary",
  "deviceCategory": "switch",
  "vendor": "Sixnet",
  "vendorOidPrefix": "1.3.6.1.4.1.20540",
  "description": "Auto-compiled with libsmi from 1 MIB module(s). 17 readable OIDs under 1.3.6.1.4.1.20540.",
  "generated": {
    "source": "mibs/sixnet",
    "date": "2026-09-12",
    "oidCount": 17,
    "compiler": "smidump 0.4.8",
    "modules": [
      "SIXNET-MIB"
    ]
  },
  "oids": [
    {
      "oid": "1.3.6.1.4.1.20540.2.1.1.1.0",
      "name": "p1status",
      "description": "The current operational state of P1 power input.",
      "type": "integer",
      "walk": false,
      "metricKey": "p1status",
      "transform": null,
      "enumMap": {
        "0": "off",
        "1": "on",
        "2": "unknown"
      },
      "module": "SIXNET-MIB",
      "tc": "SixnetDiscrete"
    },
    {
      "oid": "1.3.6.1.4.1.20540.2.1.1.2.0",
      "name": "p2status",
      "description": "The current operational state of P2 power input.",
      "type": "integer",
      "walk": false,
      "metricKey": "p2status",
      "transform": null,
      "enumMap": {
        "0": "off",
        "1": "on",
        "2": "unknown"
      },
      "module": "SIXNET-MIB",
      "tc": "SixnetDiscrete"
    },
    {
      "oid": "1.3.6.1.4.1.20540.2.1.1.3.0",
      "name": "oKstatus",
      "description": "The current operational state of OK relay output.",
      "type": "integer",
      "walk": false,
      "metricKey": "oKstatus",
      "transform": null,
      "enumMap": {
        "0": "off",
        "1": "on",
        "2": "unknown"
      },
      "module": "SIXNET-MIB",
      "tc": "SixnetDiscrete"
    },
    {
      "oid": "1.3.6.1.4.1.20540.2.1.1.4.0",
      "name": "serialNumber",
      "description": "The serial number of the device.",
      "type": "integer",
      "walk": false,
      "metricKey": "serialNumber",
      "transform": null,
      "enumMap": null,
      "module": "SIXNET-MIB"
    },
    {
      "oid": "1.3.6.1.4.1.20540.2.1.1.5.0",
      "name": "sxid",
      "description": "The SXID of the device.",
      "type": "string",
      "walk": false,
      "metricKey": "sxid",
      "transform": null,
      "enumMap": null,
      "module": "SIXNET-MIB"
    },
    {
      "oid": "1.3.6.1.4.1.20540.2.1.1.6.0",
      "name": "firmwareRevision",
      "description": "The firmware revision.",
      "type": "string",
      "walk": false,
      "metricKey": "firmwareRevision",
      "transform": null,
      "enumMap": null,
      "module": "SIXNET-MIB"
    },
    {
      "oid": "1.3.6.1.4.1.20540.2.1.1.7.0",
      "name": "fromPLCstatus",
      "description": "The current operational state of From PLC input.",
      "type": "integer",
      "walk": false,
      "metricKey": "fromPLCstatus",
      "transform": null,
      "enumMap": {
        "0": "off",
        "1": "on",
        "2": "unknown"
      },
      "module": "SIXNET-MIB",
      "tc": "SixnetDiscrete"
    },
    {
      "oid": "1.3.6.1.4.1.20540.2.1.1.8.0",
      "name": "sxAllRingsGood",
      "description": "True if all rings configured for this switch are complete.",
      "type": "integer",
      "walk": false,
      "metricKey": "sxAllRingsGood",
      "transform": null,
      "enumMap": {
        "1": "true",
        "2": "false"
      },
      "module": "SIXNET-MIB",
      "tc": "TruthValue"
    },
    {
      "oid": "1.3.6.1.4.1.20540.2.1.1.9.0",
      "name": "sxAllRingNeighborsGood",
      "description": "True if all neighbors in all configured rings for this switch are complete.",
      "type": "integer",
      "walk": false,
      "metricKey": "sxAllRingNeighborsGood",
      "transform": null,
      "enumMap": {
        "1": "true",
        "2": "false"
      },
      "module": "SIXNET-MIB",
      "tc": "TruthValue"
    },
    {
      "oid": "1.3.6.1.4.1.20540.2.1.2.1.1.2",
      "name": "pppifOperStatus",
      "description": "The current operational state of the interface.",
      "type": "integer",
      "walk": true,
      "metricKey": "pppifOperStatus",
      "transform": null,
      "enumMap": {
        "0": "unknown",
        "1": "down",
        "2": "up"
      },
      "module": "SIXNET-MIB"
    },
    {
      "oid": "1.3.6.1.4.1.20540.2.1.9999.1.1.2",
      "name": "ifAdminSpeed",
      "description": "Force port speed (in megabits/sec)",
      "type": "integer",
      "walk": true,
      "metricKey": "ifAdminSpeed",
      "transform": null,
      "enumMap": {
        "10": "m10",
        "100": "m100",
        "1000": "g1"
      },
      "module": "SIXNET-MIB"
    },
    {
      "oid": "1.3.6.1.4.1.20540.2.1.9999.1.1.3",
      "name": "ifAdminPower",
      "description": "The PHYs PwrDown bit. ifAdminPower in the down(2) state indicates that the PHY control regsiter, bit 11 is 1 (Power Down). ifAdminPower in the up(1) date indicates that the PHY control register, bi...",
      "type": "integer",
      "walk": true,
      "metricKey": "ifAdminPower",
      "transform": null,
      "enumMap": {
        "0": "down",
        "1": "up",
        "2": "unknown"
      },
      "module": "SIXNET-MIB"
    },
    {
      "oid": "1.3.6.1.4.1.20540.2.1.9999.2.0",
      "name": "ledTestTrigger",
      "description": "Trigger LED test",
      "type": "integer",
      "walk": false,
      "metricKey": "ledTestTrigger",
      "transform": null,
      "enumMap": {
        "0": "normal",
        "1": "testing"
      },
      "module": "SIXNET-MIB"
    },
    {
      "oid": "1.3.6.1.4.1.20540.2.1.9999.3.1.0",
      "name": "sixnetConfigState",
      "description": "Trigger LED test",
      "type": "integer",
      "walk": false,
      "metricKey": "sixnetConfigState",
      "transform": null,
      "enumMap": {
        "0": "idle",
        "1": "reserved",
        "2": "configure",
        "3": "working",
        "4": "done",
        "5": "crash"
      },
      "module": "SIXNET-MIB"
    },
    {
      "oid": "1.3.6.1.4.1.20540.2.1.9999.3.2.0",
      "name": "sixnetConfigResult",
      "description": "Result of configuration. Valid only when configState is done.",
      "type": "integer",
      "walk": false,
      "metricKey": "sixnetConfigResult",
      "transform": null,
      "enumMap": {
        "0": "success",
        "1": "failure",
        "99": "abort"
      },
      "module": "SIXNET-MIB"
    },
    {
      "oid": "1.3.6.1.4.1.20540.2.1.9999.3.3.0",
      "name": "sixnetConfigServer",
      "description": "The address of the configuration server. Typically an IP address but might be a FQDN.",
      "type": "string",
      "walk": false,
      "metricKey": "sixnetConfigServer",
      "transform": null,
      "enumMap": null,
      "module": "SIXNET-MIB"
    },
    {
      "oid": "1.3.6.1.4.1.20540.2.1.9999.3.4.0",
      "name": "sixnetConfigFile",
      "description": "The file to retrieve and process.",
      "type": "string",
      "walk": false,
      "metricKey": "sixnetConfigFile",
      "transform": null,
      "enumMap": null,
      "module": "SIXNET-MIB"
    }
  ]
}
