{
  "formatVersion": 1,
  "slug": "mib-sigur-generic",
  "name": "Sigur Generic (MIB)",
  "role": "dictionary",
  "deviceCategory": "generic",
  "vendor": "Sigur",
  "vendorOidPrefix": "1.3.6.1.4.1.56627",
  "description": "Auto-compiled with libsmi from 1 MIB module(s). 8 readable OIDs under 1.3.6.1.4.1.56627.",
  "generated": {
    "source": "mibs/sigur",
    "date": "2026-09-18",
    "oidCount": 8,
    "compiler": "smidump 0.4.8",
    "modules": [
      "SIGUR-MIB"
    ]
  },
  "oids": [
    {
      "oid": "1.3.6.1.4.1.56627.1.1.0",
      "name": "serialNumber",
      "description": "Serial number of controller",
      "type": "string",
      "walk": false,
      "metricKey": "serialNumber",
      "transform": null,
      "enumMap": null,
      "module": "SIGUR-MIB"
    },
    {
      "oid": "1.3.6.1.4.1.56627.1.2.1.1",
      "name": "osdpNumber",
      "description": "Number of readers",
      "type": "string",
      "walk": true,
      "metricKey": "osdpNumber",
      "transform": null,
      "enumMap": null,
      "module": "SIGUR-MIB"
    },
    {
      "oid": "1.3.6.1.4.1.56627.1.2.1.3",
      "name": "osdpAddress",
      "description": "Reader address",
      "type": "string",
      "walk": true,
      "metricKey": "osdpAddress",
      "transform": null,
      "enumMap": null,
      "module": "SIGUR-MIB"
    },
    {
      "oid": "1.3.6.1.4.1.56627.1.3.0",
      "name": "voltage",
      "description": "Power voltage",
      "type": "integer",
      "walk": false,
      "metricKey": "voltage",
      "transform": null,
      "enumMap": null,
      "module": "SIGUR-MIB"
    },
    {
      "oid": "1.3.6.1.4.1.56627.1.5.0",
      "name": "localDateTime",
      "description": "Local date time",
      "type": "string",
      "walk": false,
      "metricKey": "localDateTime",
      "transform": null,
      "enumMap": null,
      "module": "SIGUR-MIB",
      "tc": "DateAndTime"
    },
    {
      "oid": "1.3.6.1.4.1.56627.1.8.1.1",
      "name": "accessPoint",
      "description": "Access point",
      "type": "integer",
      "walk": true,
      "metricKey": "accessPoint",
      "transform": null,
      "enumMap": null,
      "module": "SIGUR-MIB"
    },
    {
      "oid": "1.3.6.1.4.1.56627.1.8.1.3",
      "name": "physicalPin",
      "description": "physicalPin",
      "type": "integer",
      "walk": true,
      "metricKey": "physicalPin",
      "transform": null,
      "enumMap": {
        "0": "portDet1Pass1",
        "1": "portDet2Pass2",
        "2": "portDet3Rte1",
        "3": "portDet4Rte2",
        "4": "portDet5StopPass3",
        "5": "portDet6Pass4",
        "6": "portDet7Rte3",
        "7": "portDet8Rte4",
        "8": "portDet9Auxin1",
        "9": "portDet10Auxin2",
        "10": "portOpd",
        "11": "portFire",
        "12": "portDcd",
        "13": "portK1",
        "14": "portK2",
        "15": "portK3",
        "16": "portK4",
        "17": "portOut1Auxout1",
        "18": "portOut2Auxout2",
        "19": "portOut3",
        "20": "portOut4",
        "21": "portOut5",
        "22": "portL1ALed1",
        "23": "portL1B",
        "24": "portL2ALed2",
        "25": "portL2B",
        "26": "portL3A",
        "27": "portL3B",
        "28": "portL4A",
        "29": "portL4B",
        "30": "portCpi1",
        "31": "portCpi2",
        "32": "portCpi3",
        "33": "portLedrx",
        "34": "portLedtx",
        "35": "portLedpwr",
        "36": "portSnd",
        "37": "portRst",
        "38": "portBat",
        "-4": "port4",
        "-3": "port3",
        "-2": "port2",
        "-1": "port1"
      },
      "module": "SIGUR-MIB"
    },
    {
      "oid": "1.3.6.1.4.1.56627.1.9.0",
      "name": "temperature",
      "description": "Internal temperature",
      "type": "integer",
      "walk": false,
      "metricKey": "temperature",
      "transform": null,
      "enumMap": null,
      "module": "SIGUR-MIB"
    }
  ]
}
